{
 "schema": "docs/plan/backlog.schema.json",
 "spec_version": "1.0",
 "spec_date": "2026-10-17",
 "generated_from": {
  "file": "docs/plan/source/proveri-babh-full-plan-bg-v1.0.html",
  "sha256": "7d78033aea6368252c3e1d6dbb4af70699799d7a94c886416184d70cfb6c3c5d"
 },
 "milestones": [
  "R0",
  "R1",
  "R2",
  "R3",
  "R4",
  "R5"
 ],
 "priorities": [
  "P0",
  "P1"
 ],
 "statuses": [
  "planned",
  "in_progress",
  "blocked",
  "in_review",
  "done",
  "dropped"
 ],
 "groups": [
  {
   "id": "ARC",
   "title": "Обхват, договори и архитектура",
   "owner": "Архитект / технически ръководител",
   "description": "ADR, contracts, repository map; само този поток променя общите договори след преглед.",
   "task_count": 8
  },
  {
   "id": "DAT",
   "title": "Модел на данните и публикуване",
   "owner": "Backend / data инженер",
   "description": "Domain repositories, schema migrations и dataset publisher.",
   "task_count": 11
  },
  {
   "id": "SRC",
   "title": "Източници, сваляне и работни задачи",
   "owner": "Data / backend инженер",
   "description": "Source adapters, durable queue и import orchestration.",
   "task_count": 12
  },
  {
   "id": "XLS",
   "title": "Четене и разпознаване на таблиците на БАБХ",
   "owner": "Parser инженер",
   "description": "Чист workbook reader; без мрежа, UI или плащания.",
   "task_count": 12
  },
  {
   "id": "NRM",
   "title": "Нормализация и качество на полетата",
   "owner": "Data quality инженер",
   "description": "Field normalizers, validation rules и quality flags.",
   "task_count": 10
  },
  {
   "id": "ING",
   "title": "Алгоритъм за състав и количества",
   "owner": "Parser / domain инженер",
   "description": "Composition lexer, AST, ingredient dictionary; без медицински решения.",
   "task_count": 12
  },
  {
   "id": "ENT",
   "title": "Фирми, роли, марки и категории",
   "owner": "Entity resolution / data инженер",
   "description": "Canonical entities и derived relationships; няма самостоятелен регистър за всеки екран.",
   "task_count": 12
  },
  {
   "id": "API",
   "title": "Търсене, филтри, договори и експорт",
   "owner": "Backend API инженер",
   "description": "Един query service за списъци, KPI, saved searches и export.",
   "task_count": 12
  },
  {
   "id": "UX",
   "title": "Дизайн система, мобилен интерфейс и достъпност",
   "owner": "UI / frontend инженер",
   "description": "Общи компоненти, layout, router и client state.",
   "task_count": 12
  },
  {
   "id": "APP",
   "title": "Потребителски екрани и премахване на дублирането",
   "owner": "Product frontend инженер",
   "description": "Екранни композиции от общите UX/API компоненти.",
   "task_count": 12
  },
  {
   "id": "ANA",
   "title": "Метрики, класации и сравнения",
   "owner": "Analytics / backend инженер",
   "description": "Един metric registry и versioned aggregates.",
   "task_count": 10
  },
  {
   "id": "ADM",
   "title": "Администрация и контрол на данните",
   "owner": "Admin frontend + backend инженер",
   "description": "Admin console върху същите domain services; не директни ad hoc SQL редакции.",
   "task_count": 14
  },
  {
   "id": "MON",
   "title": "История, наблюдение и известия",
   "owner": "Backend event/notification инженер",
   "description": "Публична история и частни watches споделят event model, но имат различен достъп.",
   "task_count": 12
  },
  {
   "id": "AI",
   "title": "Проверка на съставки с доказателства",
   "owner": "AI application / evidence инженер",
   "description": "Evidence retrieval и структурирано обяснение; не авторитетен регулаторен статус.",
   "task_count": 10
  },
  {
   "id": "IAM",
   "title": "Акаунти, организации, роли и собственост",
   "owner": "Identity / backend инженер",
   "description": "Потребител ≠ организация абонат ≠ фирма в регистъра.",
   "task_count": 12
  },
  {
   "id": "BIL",
   "title": "PRO архитектура, абонаменти и плащания",
   "owner": "Billing / backend инженер",
   "description": "Capability service и payment adapter; UI не определя платения достъп.",
   "task_count": 16
  },
  {
   "id": "SEC",
   "title": "Сигурност и защита на достъпа",
   "owner": "Security / backend инженер",
   "description": "Threat model и конкретни проверки по реалните surfaces; без неограничен pentest на live сайта.",
   "task_count": 11
  },
  {
   "id": "OPS",
   "title": "Миграции, производителност и експлоатация",
   "owner": "Platform / DevOps инженер",
   "description": "CI/CD, scheduler, backups, releases и operational runbooks.",
   "task_count": 13
  },
  {
   "id": "QA",
   "title": "Приемане, регресии и критерии за пускане",
   "owner": "Независим QA / release owner",
   "description": "Доказателства за поведение; QA не се свежда до одобрение на собствения код.",
   "task_count": 14
  }
 ],
 "tasks": [
  {
   "id": "ARC-001",
   "group": "ARC",
   "title": "Установяване на текущата версия",
   "priority": "P0",
   "milestone": "R0",
   "summary": "Свържи работещия сайт с точен commit, пакет, схема и конфигурация; сравни с историческия v6.5.0.",
   "deliverable": "baseline-manifest.json и карта на разликите",
   "owner": "Архитект / технически ръководител",
   "depends_on": [],
   "depends_note": "Проверка на външните входове",
   "acceptance": [
    "Посочени са hash и версия на текущия код",
    "Всяка стара констатация е confirmed, fixed или unverified с доказателство"
   ],
   "check": "Сравни etl.php comp_hash и текущия запис на промяна само в търговеца.",
   "evidence": [
    "DESIGN"
   ],
   "status": "in_progress",
   "status_note": "Baseline на кода (commit 4403727, v6.9.0) и проверка на 90+16 констатации са в docs/baseline/. Остава: сверяване на deployed файловете на proveribabh.com с commit-а и конкретната проверка (промяна само в търговеца) върху реални данни — няма достъп до сайта/DB в сесията от 2026-10-17.",
   "artifacts": [
    "docs/baseline/baseline-manifest.json",
    "docs/baseline/findings-verification.md"
   ],
   "covers": [
    "DESIGN"
   ],
   "wave": 0
  },
  {
   "id": "ARC-002",
   "group": "ARC",
   "title": "Осигуряване на входните данни",
   "priority": "P0",
   "milestone": "R0",
   "summary": "Събери оригинални файлове с всички части, поне три последователни пълни снимки и представителни стари формати; обезличи тестовите акаунти.",
   "deliverable": "source-corpus-manifest.json",
   "owner": "Архитект / технически ръководител",
   "depends_on": [
    "ARC-001"
   ],
   "depends_note": "",
   "acceptance": [
    "Всеки файл има произход, дата, размер и SHA-256",
    "Липсващите входове са изрично описани и блокират само съответното приемане"
   ],
   "check": "Възстанови една снимка само от manifest и оригиналните байтове.",
   "evidence": [
    "DESIGN"
   ],
   "status": "blocked",
   "status_note": "Порталът на БАБХ не е достъпен от средата на сесията (HTTPS CONNECT 403 през прокси, 2026-10-17); реалните XLSX пакети трябва да дойдат от собственика (ръчно сваляне или staging с достъп). Блокира приемането на parser/dataset (QA-002), не останалата R0 работа. Нужни: всички части на поне 3 последователни пълни снимки + стари формати, с дата, размер, SHA-256.",
   "covers": [
    "DESIGN"
   ],
   "wave": 1
  },
  {
   "id": "ARC-003",
   "group": "ARC",
   "title": "Архитектурно решение за модулен плъгин",
   "priority": "P0",
   "milestone": "R0",
   "summary": "Потвърди WordPress/PHP/MySQL ограниченията; отдели чиста обработка на данни, приложни услуги, WordPress адаптери и UI; избягвай необоснован rewrite.",
   "deliverable": "ADR-001 и карта на модулите",
   "owner": "Архитект / технически ръководител",
   "depends_on": [
    "ARC-001"
   ],
   "depends_note": "",
   "acceptance": [
    "Бизнес правилата работят без HTTP и UI",
    "Хостингът поддържа избраните транзакции, worker и storage"
   ],
   "check": "Извикай parser и entitlement policy през CLI тест без браузър.",
   "evidence": [
    "DESIGN"
   ],
   "status": "in_review",
   "status_note": "docs/adr/ADR-001-modular-plugin.md: ограничения, 5 слоя, правило за чистота, карта на всеки файл към слой. Конкретна проверка: parser през CLI без браузър е изпълнен (tests/run.sh); entitlement policy не съществува още — отложено до BIL-002/IAM-003. Хостинг лимитите не са измерени (ARC-007/OPS-001).",
   "artifacts": [
    "docs/adr/ADR-001-modular-plugin.md",
    "tests/run.sh",
    "tests/php/detect.test.php",
    "tests/js/parse-comp.test.js"
   ],
   "covers": [
    "DESIGN"
   ],
   "wave": 1
  },
  {
   "id": "ARC-004",
   "group": "ARC",
   "title": "Речник и семантика на продукта",
   "priority": "P0",
   "milestone": "R0",
   "summary": "Дефинирай регистрация, фирма, роля, марка, съставка, снимка, версия, бележка и наблюдение; фиксирай какво не доказва регистърът.",
   "deliverable": "domain-glossary.md",
   "owner": "Архитект / технически ръководител",
   "depends_on": [
    "ARC-003"
   ],
   "depends_note": "",
   "acceptance": [
    "Регистрация не се представя като уникален продукт",
    "Липса, заличаване и неизвестно са различни понятия"
   ],
   "check": "Провери едни и същи определения в API, UI, CSV и админ.",
   "evidence": [
    "DESIGN"
   ],
   "status": "in_review",
   "status_note": "Чернова на речника в docs/domain-glossary.md с текущото място на всеки термин в кода и предложения за текстове в интерфейса. Конкретната проверка (еднакви определения в API/UI/CSV/админ) е таблицата „Терминология“ — нуждае се от независим преглед. Започната като чернова преди зависимостта ARC-003 да е done; приемането ѝ чака ARC-003.",
   "artifacts": [
    "docs/domain-glossary.md"
   ],
   "covers": [
    "DESIGN"
   ],
   "wave": 2
  },
  {
   "id": "ARC-005",
   "group": "ARC",
   "title": "Версионирани договори и правила за промяна",
   "priority": "P0",
   "milestone": "R0",
   "summary": "Опиши DTO, грешки, query AST, събития и съвместимост; всички потребители използват един договор.",
   "deliverable": "OpenAPI и JSON Schema contracts",
   "owner": "Архитект / технически ръководител",
   "depends_on": [
    "ARC-004"
   ],